{
  "schemaVersion": "1.0.0",
  "ledgerId": "74747474-7474-4474-8474-747474747474",
  "transitionId": "76767676-7676-4676-8676-767676767676",
  "ledgerRevision": 2,
  "previousState": "sent",
  "state": "accepted",
  "assessmentId": "11111111-1111-4111-8111-111111111111",
  "requestEnvelopeDigest": "499f640799a20aa5d4f6d5119e632a4ab661b649f202da90675c50759536ac9a",
  "requestAlias": "78787878-7878-4878-8878-787878787878",
  "requestNonce": "89898989-8989-4989-8989-898989898989",
  "providerInvocationDigest": "57d3dd40c01c0b9395cfe2443767d65a331724b6bdc256167e7cb0b6cb931291",
  "sentAt": "2026-07-21T00:00:00.500Z",
  "acceptedAt": "2026-07-21T00:00:01Z",
  "providerResponseId": "resp_phase0_fixture_001",
  "responseEnvelopeDigest": "6a48f5fd242a0fb8c470e519fcc791db514af2a3a80960be9ef675266890510c",
  "transactionId": "74747474-4444-4444-8444-444444444444",
  "databaseCommitToken": "16a1f808b6fd132af79c007c6dce5252dce708c2e858b480cc24c7eb5dc65aac",
  "uniquenessReceipts": [
    {
      "schemaVersion": "1.0.0",
      "receiptId": "74747474-2222-4222-8222-222222222222",
      "relation": "contextualization_request_ledger",
      "constraintName": "uq_contextualization_request_alias",
      "keyDigest": "767d3951622d045fbeadd20c00bf5369cbf7be576324fb917a8cdedda68d25e2",
      "rowIdentity": "74747474-7474-4474-8474-747474747474",
      "transactionId": "74747474-1111-4111-8111-111111111111",
      "databaseCommitToken": "28818b00b2935411004b57642ab7fd72eaeead91b02a764fb44705a86f8b24b4",
      "isolationLevel": "serializable",
      "outcome": "committed",
      "committedAt": "2026-07-21T00:00:00.500Z",
      "receiptDigest": "7717c1be658496e982b11b54ed83093ad8502d0241dbc7db5bac12eeb141474a"
    },
    {
      "schemaVersion": "1.0.0",
      "receiptId": "74747474-3333-4333-8333-333333333333",
      "relation": "contextualization_request_ledger",
      "constraintName": "uq_contextualization_request_nonce",
      "keyDigest": "6f4a4dd2dca47fc282cb212d0acc1b9827703e5b7666b41ff2add732c591fce1",
      "rowIdentity": "74747474-7474-4474-8474-747474747474",
      "transactionId": "74747474-1111-4111-8111-111111111111",
      "databaseCommitToken": "28818b00b2935411004b57642ab7fd72eaeead91b02a764fb44705a86f8b24b4",
      "isolationLevel": "serializable",
      "outcome": "committed",
      "committedAt": "2026-07-21T00:00:00.500Z",
      "receiptDigest": "db93f8c3662443329f4ec2e7d907d75256dc85ae5df5aa6bf6566d4a41da3094"
    },
    {
      "schemaVersion": "1.0.0",
      "receiptId": "74747474-5555-4555-8555-555555555555",
      "relation": "contextualization_request_ledger",
      "constraintName": "uq_contextualization_provider_response_id",
      "keyDigest": "1ee4e16a3c039542145ef62a9af7f5d238118f92be0947dd18f5ce1ddf015951",
      "rowIdentity": "74747474-7474-4474-8474-747474747474",
      "transactionId": "74747474-4444-4444-8444-444444444444",
      "databaseCommitToken": "16a1f808b6fd132af79c007c6dce5252dce708c2e858b480cc24c7eb5dc65aac",
      "isolationLevel": "serializable",
      "outcome": "committed",
      "committedAt": "2026-07-21T00:00:01Z",
      "receiptDigest": "ca636cfbc4b91faf01b014a6d0b72bc789ae536866562d1528264caca32b5474"
    }
  ],
  "previousCasToken": "ddfffb8442dcd8e6f0563edf916b73e4c81bb072090556b14f953d4b963749b6",
  "createdAt": "2026-07-21T00:00:01Z",
  "casToken": "aaddbb31d2b6a069ed77ea9f42d582f0c7e4b6911f90634c77a04a4cb38fbe07"
}
